{
  "schema_id": "assistant_adoption_rollback_marker_v1",
  "kind": "assistant_adoption_rollback_marker",
  "version": "1.0",
  "status": "proposed",
  "summary": "Example assistant_adoption_rollback_marker object for Experience Adoption Forge v0.7.",
  "refs": {
    "source": "experience.shared_pattern_registry",
    "owner": "aoa-agents",
    "related": [
      "experience.v0.6.federation_harvest",
      "experience.v0.7.adoption_forge"
    ]
  },
  "payload": {
    "wave": "v0.7",
    "repo": "aoa-agents",
    "pattern_ref": "pattern.shared.wrong_surface_to_owner_landing.v1",
    "owner_surface": "aoa-agents",
    "requires_owner_consent": true,
    "rollback_required": true,
    "retention_cycles": 3,
    "kind_boundary": "assistant",
    "allowed_effects": [
      "hint",
      "escalate",
      "release_candidate"
    ],
    "forbidden_effects": [
      "persistent_self_rewrite",
      "scar"
    ],
    "rollback_path": "restore_previous_version_or_quarantine",
    "drill_required": true
  }
}
